{
  "$schema": "https://puretokensx.com/schemas/model-index.schema.json",
  "schemaVersion": 1,
  "capability": "image",
  "catalogUpdatedAt": "2026-10-18",
  "catalogCapturedAt": "2026-10-18T12:22:09.975Z",
  "defaultModel": "gpt-image-2.5-flare",
  "models": [
    {
      "id": "gemini-nano-banana-2.1",
      "aliases": [],
      "profile": "profiles/gemini-nano-banana-2.1.json"
    },
    {
      "id": "gpt-image-2",
      "aliases": [
        "image2"
      ],
      "profile": "profiles/gpt-image-2.json"
    },
    {
      "id": "gpt-image-2.5",
      "aliases": [],
      "profile": "profiles/gpt-image-2.5.json"
    },
    {
      "id": "gpt-image-2.5-flare",
      "aliases": [],
      "profile": "profiles/gpt-image-2.5-flare.json"
    },
    {
      "id": "gpt-image-2.5-sunburst",
      "aliases": [],
      "profile": "profiles/gpt-image-2.5-sunburst.json"
    },
    {
      "id": "gpt-image-2(Sub)",
      "aliases": [],
      "profile": "profiles/gpt-image-2(Sub).json"
    },
    {
      "id": "grok-imagine-image",
      "aliases": [
        "grok image"
      ],
      "profile": "profiles/grok-imagine-image.json"
    },
    {
      "id": "grok-imagine-image-quality",
      "aliases": [],
      "profile": "profiles/grok-imagine-image-quality.json"
    },
    {
      "id": "nano-banana-2",
      "aliases": [
        "nano banana 2"
      ],
      "profile": "profiles/nano-banana-2.json"
    },
    {
      "id": "nano-banana-2-lite",
      "aliases": [],
      "profile": "profiles/nano-banana-2-lite.json"
    },
    {
      "id": "nano-banana-pro",
      "aliases": [
        "nano banana pro"
      ],
      "profile": "profiles/nano-banana-pro.json"
    },
    {
      "id": "qwen-image-3.0",
      "aliases": [],
      "profile": "profiles/qwen-image-3.0.json"
    },
    {
      "id": "qwen-image-3.0-pro",
      "aliases": [],
      "profile": "profiles/qwen-image-3.0-pro.json"
    },
    {
      "id": "wan2.7-image",
      "aliases": [],
      "profile": "profiles/wan2.7-image.json"
    },
    {
      "id": "wan2.7-image-pro",
      "aliases": [],
      "profile": "profiles/wan2.7-image-pro.json"
    }
  ]
}
