{
  "$schema": "https://puretokensx.com/schemas/model-index.schema.json",
  "schemaVersion": 1,
  "capability": "video",
  "catalogUpdatedAt": "2026-10-21",
  "catalogCapturedAt": "2026-10-21T02:29:21.846Z",
  "defaultModel": "MiniMax-H3",
  "models": [
    {
      "id": "grok-imagine-video",
      "aliases": [
        "grok video"
      ],
      "profile": "profiles/grok-imagine-video.json"
    },
    {
      "id": "grok-imagine-video-1.5",
      "aliases": [],
      "profile": "profiles/grok-imagine-video-1.5.json"
    },
    {
      "id": "MiniMax-H3",
      "aliases": [],
      "profile": "profiles/MiniMax-H3.json",
      "supportScope": "reviewed_source"
    },
    {
      "id": "muse-video",
      "aliases": [],
      "profile": "profiles/muse-video.json"
    },
    {
      "id": "omni",
      "aliases": [],
      "profile": "profiles/omni.json"
    },
    {
      "id": "seedance-2.0",
      "aliases": [],
      "profile": "profiles/seedance-2.0.json"
    },
    {
      "id": "seedance-2.0-fast",
      "aliases": [],
      "profile": "profiles/seedance-2.0-fast.json"
    },
    {
      "id": "seedance-2.0-mini",
      "aliases": [],
      "profile": "profiles/seedance-2.0-mini.json"
    },
    {
      "id": "seedance-2.5",
      "aliases": [],
      "profile": "profiles/seedance-2.5.json"
    },
    {
      "id": "veo_fast",
      "aliases": [],
      "profile": "profiles/veo_fast.json"
    },
    {
      "id": "veo_lite",
      "aliases": [],
      "profile": "profiles/veo_lite.json"
    },
    {
      "id": "veo_quan",
      "aliases": [],
      "profile": "profiles/veo_quan.json"
    },
    {
      "id": "viduq3-pro",
      "aliases": [],
      "profile": "profiles/viduq3-pro.json",
      "supportScope": "reviewed_source"
    },
    {
      "id": "viduq3-turbo",
      "aliases": [],
      "profile": "profiles/viduq3-turbo.json",
      "supportScope": "reviewed_source"
    },
    {
      "id": "wan3.0-video",
      "aliases": [],
      "profile": "profiles/wan3.0-video.json"
    },
    {
      "id": "wan3.0-video-prime",
      "aliases": [],
      "profile": "profiles/wan3.0-video-prime.json"
    },
    {
      "id": "kling-v3",
      "aliases": [],
      "profile": "profiles/kling-v3.json",
      "supportScope": "reviewed_source"
    },
    {
      "id": "kling-v3-turbo",
      "aliases": [],
      "profile": "profiles/kling-v3-turbo.json",
      "supportScope": "reviewed_source"
    },
    {
      "id": "viduq4-preview",
      "aliases": [],
      "profile": "profiles/viduq4-preview.json",
      "supportScope": "reviewed_source"
    },
    {
      "id": "Super Vega 1.0-lite",
      "aliases": [],
      "profile": "profiles/Super Vega 1.0-lite.json",
      "supportScope": "reviewed_source"
    },
    {
      "id": "Super Vega 1.0-pro",
      "aliases": [],
      "profile": "profiles/Super Vega 1.0-pro.json",
      "supportScope": "reviewed_source"
    },
    {
      "id": "Super Vega 1.0-pro-fast",
      "aliases": [],
      "profile": "profiles/Super Vega 1.0-pro-fast.json",
      "supportScope": "reviewed_source"
    },
    {
      "id": "Super Vega 1.0-pro-mini",
      "aliases": [],
      "profile": "profiles/Super Vega 1.0-pro-mini.json",
      "supportScope": "reviewed_source"
    },
    {
      "id": "Super Vega 1.5-pro",
      "aliases": [],
      "profile": "profiles/Super Vega 1.5-pro.json",
      "supportScope": "reviewed_source"
    }
  ]
}
